date,domain,topic,summary,hype_score,sentiment,keywords,narrative,link
2026-05-10,AI & LLM Frontier,ACDL: Standardizing Agentic Context Management,"The Agentic Context Description Language (ACDL) provides a framework for reverse-engineering and documenting the internal context loops of projects like OpenCode and OpenClaw. It treats LLM context as a structured sequence of information pieces, allowing developers to model agent dynamics independently of specific code implementations.",6,Bullish,"['ACDL', 'Context Mapping', 'Agentic Loops']","As agentic systems become more complex, standardizing how context is structured and exchanged is vital for debugging and cross-platform interoperability.",https://arxiv.org/html/2605.01920v1
2026-05-10,AI & LLM Frontier,Specialized SLMs for Agentic Execution,"Terminus-4B demonstrates that a 4-billion parameter model fine-tuned via SFT and Reinforcement Learning can replace frontier models for specific agentic subtasks like terminal execution. This architectural shift isolates verbose outputs within subagent contexts, keeping the primary agent's context window clean and efficient.",8,Bullish,"['SLM', 'SFT', 'Reinforcement Learning']","The move toward specialized, smaller models for sub-tasks reduces latency and operational costs while maintaining high performance in multi-agent workflows.",https://arxiv.org/html/2605.03195v1
2026-05-10,AI & LLM Frontier,TREX and the Automation of LLM Fine-Tuning,TREX utilizes agent-driven tree-based exploration to automate the complex systems engineering tasks involved in LLM fine-tuning and data engineering. The accompanying FT-Bench provides a new standard for evaluating an agent's ability to navigate repository-level code and training algorithms autonomously.,7,Bullish,"['FT-Bench', 'Automated Fine-tuning', 'Tree-based Exploration']",Automating the AI research and training process suggests a future where AI systems can self-optimize and manage their own lifecycle with minimal human intervention.,https://arxiv.org/html/2604.14116v2
2026-05-10,AI & LLM Frontier,Open Source Parity with Frontier Models,"By early 2026, open-source models like DeepSeek V4 have reached 1 trillion parameters, matching the performance of proprietary leaders on major benchmarks. The market is seeing a major release every 72 hours, democratizing frontier-level capabilities for users running local hardware.",9,Bullish,"['Open Weights', 'DeepSeek V4', 'Local Inference']",The rapid convergence of open-source and proprietary performance shifts the competitive advantage from raw model power to specialized integration and data privacy.,https://www.reddit.com/r/PromptEngineering/comments/1rv9odx/the_open_source_ai_situation_in_march_2026_is/
2026-05-10,AI & LLM Frontier,Evolution of Agentic Engineering Education,Developers are moving away from abstract 'magic' agent frameworks toward a hybrid approach that combines API usage with local orchestration. The focus is shifting to understanding the fundamental 'connective tissue' of multi-agent pipelines rather than relying on theoretical abstractions.,5,Neutral,"['Multi-agent Pipelines', 'Hybrid Architectures', 'Orchestration']",The transition from hype-driven demos to robust engineering highlights a maturing sector where practical implementation skills are becoming the primary bottleneck.,https://www.reddit.com/r/LangChain/comments/1s3dw4r/developers_who_actually_built_ai_agents_whats_the/
2026-05-10,The AI Bubble (Infra),The AI CapEx Supercycle Transition,"Hyperscalers are currently engaged in a massive capital expenditure cycle focusing on GPUs, power, and data center infrastructure. While growth is currently non-linear, a future market repricing is expected as ROI expectations tighten for model labs and non-defensible startups.",9,Neutral,"['CapEx Supercycle', 'Hyperscaler', 'ROI']","This signals a shift from speculative hype to a fundamental infrastructure build-out, identifying that while the 'bubble' may reprice, the underlying hardware moats remain valuable.",https://www.reddit.com/r/ArtificialInteligence/comments/1pc0j2s/there_is_no_ai_bubble_what_were_living_through_is/
2026-05-10,The AI Bubble (Infra),DRAM Supply Reallocation for AI,The surging demand for high-end AI chips is forcing manufacturers to divert production lines away from lower-end semiconductor products. This creates a supply-side bottleneck that prioritizes high-performance computing hardware over consumer-grade electronics.,8,Bullish,"['DRAM', 'Semiconductor', 'Supply Chain']","It demonstrates how AI infrastructure needs are physically restructuring the global hardware manufacturing landscape, favoring high-margin specialized components.",https://www.reddit.com/r/NVDA_Stock/best/
2026-05-10,The AI Bubble (Infra),Data Center Infrastructure Resilience,Physical data centers are viewed as foundational 'railroad' assets that maintain utility even if AI software growth decelerates. Their role as essential infrastructure for modern computing provides a safety net against volatility in the AI application layer.,7,Bullish,"['Data Center', 'Physical Infrastructure', 'Asset Resilience']",This emphasizes that the physical backbone of the AI sector is less susceptible to bubble-bursting than the speculative software and model layers.,https://www.reddit.com/r/datacenter/comments/1nr76nh/how_would_the_potential_burst_of_the_ai_bubble/
2026-05-10,The AI Bubble (Infra),Token Consumption and Practical Utility,"Increasing token usage for developer productivity and boilerplate code suggests that AI has reached a level of baseline utility that is hard to displace. Even if financial valuations fluctuate, the underlying demand for compute tokens remains driven by real-world efficiency gains.",6,Bullish,"['Token Usage', 'Boilerplate', 'Developer Productivity']","The persistence of high token volumes indicates that the technology has integrated into workflows, creating a floor for demand that speculative cycles cannot easily erode.",https://www.reddit.com/r/ExperiencedDevs/comments/1s9qjf1/people_talking_about_the_ai_bubble_bursting_but/
2026-05-10,The AI Bubble (Infra),Liquidity Spread and Transactional Costs,Hidden costs in digital asset transactions often emerge from the spread between buy and sell prices rather than visible commission fees. Efficient infrastructure requires users to monitor actual receipts to account for these slippage costs in high-frequency environments.,3,Neutral,"['Spread', 'Liquidity', 'XRP']",This highlights the operational inefficiencies and hidden costs that must be managed as financial infrastructure becomes increasingly digitized and automated.,https://www.reddit.com/r/Ripple/
2026-05-10,Cybersecurity,Windows Kernel Privilege Escalation Zero-Day,A new vulnerability discovered by researcher Abdelhamid Naceri allows attackers to bypass existing patches to gain administrative rights on Windows systems. This flaw highlights the ongoing challenge of achieving complete remediation for local privilege escalation vectors within the Microsoft ecosystem.,8,Bearish,"['Privilege Escalation', 'Zero-Day', 'LPE']","This represents a critical failure in patch management and OS integrity, forcing enterprises to reassess their internal trust models and endpoint security posture.",https://www.reddit.com/r/cybersecurity/comments/r0hmkc/zeroday_windows_vulnerability_enables_threat/
2026-05-10,Cybersecurity,AI-Augmented Vulnerability Research and Evasion,New offensive frameworks like WAFMANCER and DeepZero utilize AI agents and deep learning models to automate zero-day discovery and bypass web application firewalls. These tools integrate Graph Neural Networks and Transformers to synthesize malicious payloads and analyze kernel drivers at scale.,9,Bearish,"['WAF Evasion', 'AI Agents', 'Transformers']","The democratization of AI-powered offensive tools significantly lowers the barrier for complex attacks, necessitating a move toward AI-driven defensive counterparts to maintain parity.",https://github.com/topics/zero-day?o=desc&s=updated
2026-05-10,Cybersecurity,Weaponized Social Platform and Protocol Exploits,"Public repositories are hosting functional exploits for HTTP/2 rapid reset attacks and Discord-based steganography that executes malicious JavaScript via image previews. Additionally, emerging tools focus on disabling native Windows security features like SmartScreen to facilitate persistent infections.",7,Bearish,"['CVE-2023-44487', 'Steganography', 'RCE']","The rapid publication of PoC exploits for modern protocols and social platforms accelerates the time-to-exploit for attackers, targeting everyday software used in corporate environments.",https://github.com/topics/zero-day?l=python
2026-05-10,Cybersecurity,Advanced EDR Evasion for Ransomware,Specialized research is demonstrating how zero-day ransomware variants can bypass traditional Endpoint Detection and Response systems using advanced evasion techniques. These projects focus on circumventing behavioral analysis and signature-based detection to ensure successful encryption of target systems.,7,Bearish,"['EDR Evasion', 'Ransomware', 'Endpoint Security']","As ransomware groups evolve, the focus is shifting from simple payload delivery to sophisticated architectural bypasses of the very security tools meant to protect the enterprise.",https://github.com/Prosfinity/Zero-Day-Ransomware-Bypass-All-EDR-s
2026-05-10,Cybersecurity,Cloud-Native Threat Hunting and KQL Standardization,Security engineers are increasingly adopting shared KQL queries for Microsoft Defender and Azure Sentinel to detect advanced threats across hybrid cloud environments. These detection rules move beyond simple IOCs to focus on behavioral hunting for complex patterns similar to those used by APTs.,6,Bullish,"['KQL', 'Azure Sentinel', 'Detection Engineering']","Collaborative detection engineering and shared hunting queries represent a maturing defensive community that is shifting toward proactive, data-driven security operations.",https://github.com/topics/zero-day?o=desc&s=forks
2026-05-10,Consumer Tech,Apple Ambient Computing Roadmap,Apple is expanding its spatial computing ecosystem with a second-generation Vision Pro and camera-equipped AirPods slated for 2026-2027. This roadmap signals a strategic pivot toward diverse wearable form factors including smart glasses designed to compete with Meta’s hardware.,9,Bullish,"['Spatial Computing', 'Computer Vision', 'Wearable Hardware']","This indicates a shift from a single high-end headset to an integrated ecosystem of ambient devices, aiming to make augmented reality a ubiquitous part of the consumer lifestyle.",https://www.reddit.com/r/VisionPro/comments/1g2qscd/apples_next_4_vision_devices_according_to_mark/
2026-05-10,Consumer Tech,Multimodal Assistive Wearables,New wearable platforms are integrating camera systems and GPS to provide real-time object identification and navigation for the visually impaired. These systems utilize auditory feedback and multimodal AI to convert visual data into actionable spatial reasoning for users.,6,Bullish,"['Multimodal Feedback', 'Assistive Technology', 'Real-time OCR']",The application of high-end sensor fusion in the assistive tech sector proves that consumer wearables are evolving beyond entertainment toward life-essential utility and inclusion.,https://arxiv.org/pdf/2505.10875
2026-05-10,Consumer Tech,LLM Democratization and Efficiency,The technical landscape of 2024 saw the collapse of the GPT-4 performance barrier and a significant reduction in LLM operational costs. Multimodal capabilities like live video and audio are now common features that can be executed locally on consumer-grade laptops.,10,Bullish,"['Multimodal LLM', 'Local Inference', 'Commoditized AI']","The shift from expensive cloud-based APIs to efficient, local multimodal models enables developers to build privacy-focused, real-time AI applications at scale.",https://gist.github.com/tkersey/e4d9923922d80c065f9d
2026-05-10,Consumer Tech,Emerging Market Hardware Barriers,High import taxes and low purchasing power in regions like Brazil are making handheld gaming devices economically unviable for the average consumer. This creates a significant gap between technical availability and actual market penetration in large demographic segments.,3,Bearish,"['Import Taxation', 'Market Penetration', 'Hardware Accessibility']","Economic and regulatory hurdles in emerging markets act as a major bottleneck for global hardware adoption, potentially forcing a pivot toward cloud gaming or local manufacturing.",https://www.reddit.com/r/SBCGaming/comments/1qgnzmy/handheld_gaming_in_brazil_is_almost_unviable_for
2026-05-10,Consumer Tech,Modular Generative AI Workflows,"Tools like ComfyUI are enabling sophisticated local workflows for video generation, face swapping, and image captioning using LLaVA models. These custom nodes allow users to orchestrate complex AI reasoning processes without relying on external filtered services.",8,Bullish,"['ComfyUI', 'Model Orchestration', 'Generative Video']","The rise of modular, open-source AI management tools empowers creators to bypass SaaS limitations and build professional-grade content pipelines on their own hardware.",https://github.com/ComfyUI-Workflow/awesome-comfyui
2026-05-10,FinTech & Web3,Multi-Chain Stablecoin Ecosystem Nodes,The expansion of the Frax Finance ecosystem via community-driven n8n nodes enables automated governance and cross-chain bridge operations like FraxFerry. New reference frameworks are also emerging to standardize multi-currency stablecoin issuance on specialized enterprise chains like Canton.,8,Bullish,"['TWAMM', 'Liquid Staking', 'Multi-chain']","The shift toward automated, modular node infrastructure allows for more complex stablecoin operations and cross-chain liquidity management without manual intervention.",https://github.com/topics/stablecoin?o=asc&s=stars
2026-05-10,FinTech & Web3,Institutional Asset Compliance Protocols,"The Regulatory Compliance Protocol (RCP) acts as a technical bridge for tokenized capital markets, improving upon the ERC-1400 and ERC-3643 standards for asset tokenization. It focuses on achieving atomic transaction settlement between legacy financial systems and digital native assets while maintaining strict regulatory adherence.",9,Bullish,"['ERC-1400', 'RWA Tokenization', 'Atomic Settlement']","Solving the regulatory interoperability gap is the primary bottleneck for institutional entry into Web3, making RCP-like frameworks essential for long-term growth.",https://arxiv.org/html/2603.29278v1
2026-05-10,FinTech & Web3,Algorithmic DeFi Strategy Development,High developer activity in the 'web3-ethereum-defi' repository suggests a maturing landscape for decentralized algorithmic trading and backtesting frameworks. Multiple forks indicate that technical teams are building proprietary extensions for automated portfolio management on Ethereum-based protocols.,7,Bullish,"['Algorithmic Trading', 'Backtesting', 'DeFi']",The rise of institutional-grade trading tools in the open-source space lowers the barrier for sophisticated quant strategies to be executed on-chain.,https://github.com/tradingstrategy-ai/web3-ethereum-defi/forks?include=active%2Carchived&period=2y&sort_by=stargazer_counts
2026-05-10,FinTech & Web3,DeFi Security and Audit-Driven Forking,Increased forking of DeFi strategy libraries by security-focused entities like Panther Audits indicates a trend toward rigorous local testing and simulation of smart contract interactions. These forks allow developers to stress-test trading logic and security vulnerabilities in a controlled environment prior to deployment.,6,Neutral,"['Smart Contract Audit', 'Regression Testing', 'Formal Verification']","A focus on security and audit-ready codebases is a sign of industry professionalization, even if it slows the immediate speed of new feature launches.",https://github.com/tradingstrategy-ai/web3-ethereum-defi/forks?include=active&period=2y&sort_by=stargazer_counts
2026-05-10,FinTech & Web3,Automated Stablecoin Yield Routing,New routing protocols for stablecoins like USDC and DAI are being developed to automate the search for optimal yield across fragmented liquidity pools. These tools abstract the complexity of yield farming by programmatically shifting capital to the most efficient decentralized exchanges.,7,Bullish,"['Yield Router', 'Liquidity Provision', 'DEX Aggregator']","As liquidity fragments across L2s and sidechains, automated routing is necessary to maintain capital efficiency and maximize returns for stablecoin holders.",https://github.com/topics/stablecoin?o=desc&s=updated
2026-05-11,AI & LLM Frontier,Standardization of Agentic Context Languages (ACDL),"The research proposes ACDL as a formal language to solve the ambiguity in how agentic LLMs assemble and evolve context during multi-step tasks. It aims to replace ad-hoc diagrams and verbal descriptions with precise, unambiguous context structures for better model interoperability.",7,Bullish,"['ACDL', 'Agentic Context', 'Context Construction']","As agents move from simple chat to complex, multi-turn tool use, standardizing context evolution is critical for debugging, benchmarking, and scaling autonomous systems across different model architectures.",https://arxiv.org/html/2605.01920v1
2026-05-11,AI & LLM Frontier,Shift Toward Professional Local Agentic Workflows,Community focus on Reddit's LocalLLaMA indicates a strong shift toward using open-weight models for specialized agentic coding and professional tool-use. Users are prioritizing detailed setup configurations and frameworks over general-purpose chat capabilities.,8,Bullish,"['Open Weights', 'Agentic Coding', 'LocalLLaMA']",The democratization of agentic capabilities through open-source weights reduces reliance on proprietary APIs and allows for deeper integration of LLMs into private professional environments.,https://www.reddit.com/r/LocalLLaMA/comments/1sknx6n/best_local_llms_apr_2026/
2026-05-11,AI & LLM Frontier,Specialized Subagents for Terminal Execution,"Terminus-4B illustrates a trend of using small, specialized models to handle verbose subtasks like terminal execution and dependency management. This approach prevents frontier models from suffering context displacement caused by high-token output noise.",9,Bullish,"['Terminus-4B', 'Context Displacement', 'Specialized Subagents']","Moving toward a modular architecture where small models handle 'dirty' infrastructure tasks allows larger frontier models to remain focused on high-level reasoning and planning, significantly optimizing cost and performance.",https://arxiv.org/html/2605.03195v1
2026-05-11,AI & LLM Frontier,Automated LLM Optimization via Agentic R&D,The TREX framework automates the fine-tuning process by using agents to perform tree-based exploration of experimental designs. This allows AI to evolve from a simple research tool into an autonomous partner capable of self-optimizing its own training cycles.,7,Bullish,"['Tree-based Exploration', 'Autonomous Fine-tuning', 'TREX']",Automating the labor-intensive experimental phase of model training accelerates the development of domain-specific LLMs and reduces the human expertise bottleneck in AI research.,https://arxiv.org/html/2604.14116v2
2026-05-11,AI & LLM Frontier,Scaling Infrastructure: Go and Rust Migration,"Major AI players like OpenAI are rewriting core connection stacks in Go to handle massive user loads, while high-performance tools like Bun are migrating to Rust. This reflects a broader industry shift toward memory-safe, high-concurrency languages to support real-time AI services.",6,Neutral,"['Rust', 'Go', 'Infrastructure Rewrite']","While agentic hype remains high, the actual industry heavy-lifting is currently focused on hardening the 'plumbing' of AI systems to ensure they can scale to billions of users reliably.",https://github.com/zhaoolee/garss
2026-05-11,The AI Bubble (Infra),HBM-Led Memory Supercycle,"High Bandwidth Memory (HBM) demand is projected to surge as AI infrastructure shifts toward specialized ASIC-based chips for training and inference. This transition is driving a structural increase in memory and storage density per server, particularly within the HBM3E and enterprise SSD segments.",9,Bullish,"['HBM3E', 'ASIC', 'eSSD']",The shift from general-purpose GPUs to specialized silicon indicates a maturing market where memory bandwidth and storage density are the primary bottlenecks for scaling next-gen models.,https://www.reddit.com/r/Netlist_/comments/1qclyl3/2026_market_outlook_focus_on_the_hbmled_memory/
2026-05-11,The AI Bubble (Infra),Global AI Infrastructure Arms Race,Global AI capital expenditure is reaching historic levels with a projected $700 billion investment in 2026 to expand data center capacity and GPU clusters. This unprecedented scale is forcing a compressed construction pipeline and extreme demand for advanced packaging and liquid cooling technologies.,10,Bullish,"['Liquid Cooling', 'Advanced Packaging', 'Data Center Capacity']","The sheer scale of investment suggests that the AI sector is currently fueled by a physical arms race for compute sovereignty and data center real estate, regardless of near-term software monetization.",https://www.reddit.com/r/ThinkingDeeplyAI/comments/1r0ndyv/700_billion_will_be_invested_in_the_ai/
2026-05-11,The AI Bubble (Infra),Strategic Pivot to Custom AI Silicon,Hyperscalers and AI labs are increasingly bypassing general-purpose hardware in favor of custom-designed silicon like TPUs and MTIA accelerators to optimize specific workloads. Companies like Broadcom are emerging as critical providers of the networking IP and packaging required to scale these chips to multi-gigawatt compute levels.,8,Bullish,"['TPU', 'Custom Silicon', 'Networking IP']",Diversifying away from Nvidia-dependence allows major players to reduce costs and gain performance advantages through hardware architectures tailored specifically for their own neural networks.,https://www.reddit.com/r/investing/comments/1rn6ntl/broadcom_q1_fy2026_the_ai_infrastructure_story/
2026-05-11,The AI Bubble (Infra),Grid Integration and Power Efficiency,"As data centers scale, focus is shifting toward unified compute packages like AMD's Instinct series that prioritize performance-per-watt for large-scale training. Physical grid constraints are forcing facilities into remote regions and necessitating the integration of Energy Storage Systems (ESS) for power smoothing.",7,Neutral,"['ESS', 'Performance-per-watt', 'Grid Integration']","Technical limits in power distribution and energy efficiency are becoming the primary gatekeepers, determining where and how fast the next phase of AI infrastructure can grow.",https://arxiv.org/html/2603.00415v2
2026-05-11,The AI Bubble (Infra),Hyperscale Compute Buffer Commitments,Meta has secured $237 billion in non-cancelable contractual commitments to ensure it maintains a massive compute buffer for future model generations. This high capex intensity reflects a defensive strategy to mitigate capacity constraints while long-term custom silicon projects are still being phased in.,9,Bullish,"['Capex Intensity', 'Compute Buffer', 'Contractual Commitments']","The massive financial lock-in signals that leading AI developers view massive compute capacity as a non-negotiable strategic asset, prioritising availability over immediate margin optimization.",https://www.reddit.com/r/ValueInvesting/comments/1t16ndd/meta_meta_q1_2026_33_revenue_growth_vs_the_237b/
2026-05-11,Cybersecurity,Neural Threat Detection & XAI Frameworks,Emerging frameworks are integrating Deep Reinforcement Learning and Generative Adversarial Networks to identify zero-day vulnerabilities in real-time. These systems utilize eXplainable AI (XAI) to provide transparent reasoning for Network Intrusion Detection System classifications.,8,Bullish,"['Deep Reinforcement Learning', 'XAI', 'GANs']","As traditional signature-based detection fails against novel exploits, the industry is shifting toward self-learning defensive architectures that can predict and mitigate threats before they are indexed.",https://github.com/topics/zero-day?o=asc&s=stars
2026-05-11,Cybersecurity,AI-Agentic Vulnerability Discovery,"Autonomous AI agents are being deployed to automate large-scale vulnerability research, specifically targeting Windows kernel driver IOCTLs. These frameworks also incorporate payload synthesis for bypassing Web Application Firewalls through iterative mutation.",9,Bearish,"['AI Agents', 'WAF Evasion', 'IOCTL Analysis']","The use of multimodal AI agents to find zero-days while 'sleeping' represents a significant escalation in offensive capabilities, drastically reducing the time required for deep-system exploit development.",https://github.com/topics/zero-day?o=desc&s=updated
2026-05-11,Cybersecurity,Automated Mass Exploitation Tooling,New high-speed multi-threaded scanners and exploit builders are surfacing to automate the validation and exploitation of specific CVEs across platforms like cPanel and WinRAR. These tools prioritize rapid target acquisition and bulk execution to maximize the impact of known vulnerabilities.,6,Bearish,"['Multi-threaded Scanning', 'Exploit Builder', 'CVE-2026-41940']","The automation of the exploit lifecycle reduces the window for administrators to apply patches, making rapid response and automated patch management more critical than ever.",https://github.com/topics/zero-day-exploit
