date,domain,topic,summary,hype_score,sentiment,keywords,narrative,link
2026-05-08,Software Engineering,Autonomous Agent Engineering Frameworks,"This initiative aims to synthesize a unified software engineering rule set designed to govern the behavior and workflows of AI coding agents. Drawing from 'agent-rules-books' repositories, the project targets a standardized deployment cycle by May 2026.",8,Bullish,"['AI Agents', 'Agentic Workflow', 'Unified Rule Set']","As AI agents become more prevalent in the SDLC, the industry is shifting toward standardized orchestration protocols to ensure code quality and safety across autonomous systems.",https://github.com/jsboige/roo-extensions/issues/1936
2026-05-08,Software Engineering,MCP Ecosystem and Production Benchmarking,The Cline project is establishing a marketplace for Model Context Protocol (MCP) servers to extend AI assistant capabilities to enterprise tools like Linear. It also introduces real-world benchmarks derived from production sessions to validate LLM performance on complex engineering tasks.,9,Bullish,"['MCP', 'Linear Integration', 'Coding Benchmarks']",The adoption of MCP represents a significant move toward interoperable AI tools that can interact with the full developer stack rather than operating in isolation.,https://github.com/cline
2026-05-08,Software Engineering,Orchestrator-Centric Datacenter Digital Twins,OpenDT introduces a self-calibrating digital twin architecture designed to simulate datacenter performance and sustainability through an orchestrator-centric model. The framework leverages telemetry and compute-intensive simulations to optimize resource management for future network services.,6,Bullish,"['Digital Twin', 'Telemetry', 'Resource Orchestration']",Digital twins are becoming essential for managing the increasing complexity and energy demands of modern cloud infrastructure and 6G networks.,https://arxiv.org/pdf/2604.11445
2026-05-08,Software Engineering,AI IDE Community and Privacy Governance,The Trae AI community is establishing rigorous governance and privacy rules to manage user interactions and proprietary data within its development ecosystem. The platform utilizes a credit-based system to facilitate access to its AI-native IDE features.,7,Neutral,"['AI-Native IDE', 'Data Privacy', 'Community Governance']","As AI-driven development tools proliferate, the focus is expanding beyond features to include the social and ethical frameworks required to protect developer intellectual property.",https://www.reddit.com/r/Trae_ai/
2026-05-08,Software Engineering,Software Lifecycle Maintenance Transitions,"Iceflake Studios has taken over the development of Cities: Skylines II, highlighting the complexities of studio-level software handovers for large-scale projects. This transition emphasizes the ongoing technical debt management and community-facing updates required for complex simulation software.",4,Neutral,"['Legacy Maintenance', 'Studio Transition', 'Simulation Software']",Effective project handovers are critical in long-term software maintenance cycles to ensure product continuity and technical stability after original developers depart.,https://www.reddit.com/r/CitiesSkylines/comments/1t59nyo/were_iceflake_studios_the_new_development_team/
2026-05-08,Cybersecurity,Windows Kernel Elevation of Privilege PoC,"This repository provides a proof-of-concept for CVE-2025-62215, a Windows Kernel elevation of privilege (EoP) vulnerability confirmed as an active zero-day. The exploit targets the core operating system layer to bypass security boundaries, enabling unauthorized administrative access.",8,Bearish,"['Windows Kernel', 'Elevation of Privilege', 'Zero-Day']",Kernel-level vulnerabilities are critical because they undermine the OS trust model; public PoC code significantly lowers the barrier for attackers to weaponize these exploits in enterprise environments.,https://github.com/dexterm300/CVE-2025-62215-exploit-poc
2026-05-08,Cybersecurity,Fortinet Perimeter Security Zero-Day,A new disclosure highlights CVE-2026-35616 as an actively exploited zero-day vulnerability affecting Fortinet infrastructure. Security communities are sounding the alarm as this flaw allows attackers to compromise network security gateways before patches are widely applied.,9,Bearish,"['Fortinet', 'Zero-Day', 'Network Security']","Vulnerabilities in edge security hardware are catastrophic for the industry as they provide an initial entry point into otherwise secured corporate networks, bypassing internal firewalls.",https://www.reddit.com/r/cybersecurity/comments/1scm5bc/fortinet_cve202635616_actively_exploited_as_zero/
2026-05-08,Cybersecurity,iOS Zero-Click RCE via CoreAudio,"CVE-2025-31200 is a highly sophisticated zero-click remote code execution vulnerability in the iOS AudioConverterService that bypasses Blastdoor protections. This attack chain, triggered via simple iMessage or SMS, allows for kernel escalation and sensitive token theft on unpatched devices.",10,Bearish,"['Zero-Click', 'RCE', 'AudioConverterService']","Zero-click exploits represent the highest tier of threat to mobile security, as they require no user interaction and demonstrate that even advanced sandboxing like Apple's Blastdoor is not infallible.",https://github.com/topics/zero-day?o=desc&s=updated
2026-05-08,Cybersecurity,IDS Behavioral Analysis for Zero-Day Detection,This academic study explores whether Intrusion Detection Systems (IDS) can effectively distinguish between novel attack behaviors and novel vulnerabilities. It advocates for integrating SIEM and endpoint protection into a multi-layered defensive architecture to counter emerging threats.,5,Neutral,"['IDS', 'SIEM', 'Behavioral Analysis']","As the volume of zero-day exploits increases, the industry is pivoting from signature-based detection toward proactive behavioral modeling to identify threats based on their actions rather than known code patterns.",https://arxiv.org/pdf/2605.03138
2026-05-08,Cybersecurity,WinRAR CVE-2025-8088 Exploit Release,"A public C++ implementation of the exploit for CVE-2025-8088 has surfaced, targeting a vulnerability in the WinRAR compression utility. This release enables broader exploitation of a widely used legacy application often found in corporate and personal environments.",7,Bearish,"['WinRAR', 'C++', 'PoC']","The persistence of vulnerabilities in ubiquitous software like WinRAR demonstrates a massive attack surface for phishing and malware delivery, as these applications often lack the auto-update rigors of modern browsers.",https://github.com/topics/zero-day?l=c%2B%2B
2026-05-08,Maritime AI,Sim-to-Real Autonomous Vessel Navigation,This research introduces the Sim2Sea framework for transferring autonomous navigation policies from simulation to physical maritime vessels in high-density environments. The system utilizes GNSS perception suites and deep reinforcement learning to bridge the reality gap for complex multi-agent maritime interactions.,8,Bullish,"['Sim-to-Real', 'GNSS', 'Reinforcement Learning']",Real-world testing for autonomous ships is prohibitively expensive and risky; mastering sim-to-real transfer is the critical catalyst needed to scale autonomous shipping fleets globally.,https://arxiv.org/html/2603.04057v1
2026-05-08,Maritime AI,Maritime Small Language Models via Synthetic AIS Data,"The paper details a methodology for fine-tuning Small Language Models (SLMs) using synthetic datasets generated from Automatic Identification System (AIS) logs. This approach enables the deployment of cost-effective, mission-critical AI on specialized maritime hardware with limited computational resources.",7,Bullish,"['AIS', 'SLM', 'Synthetic Data']","As vessels move toward edge computing, the ability to run lightweight, domain-specific models trained on synthetic data reduces reliance on expensive satellite links and heavy cloud infrastructure.",https://arxiv.org/html/2509.13047v2
2026-05-08,Maritime AI,Zero-Shot SAR Ship Instance Segmentation,This study leverages foundation models to perform zero-shot ship instance segmentation on Synthetic Aperture Radar (SAR) imagery without requiring dense pixel-level annotations. The method specifically addresses the optical-to-SAR domain gap to provide precise vessel orientation and structure data in all-weather conditions.,9,Bullish,"['SAR', 'Zero-Shot', 'Instance Segmentation']","SAR is essential for 24/7 global maritime surveillance, and removing the bottleneck of manual data labeling through zero-shot learning drastically accelerates vessel identification and security response times.",https://arxiv.org/html/2604.17920v1
2026-05-08,Maritime AI,Edge-to-Core Marine Bioacoustic Pipelines,This project demonstrates a rapid application development framework using Pegasus workflows and BlueField-3 DPUs for processing marine bioacoustic sensor data. The architecture enables execution-agnostic workflows that are optimized via LLM-assisted generation for distributed maritime environments.,6,Neutral,"['DPU', 'Bioacoustics', 'Edge-to-Core']",Efficiently moving data from sensors to actionable insights requires advanced infrastructure; streamlining these pipelines is vital for real-time environmental monitoring and subsea acoustic analysis.,https://arxiv.org/html/2605.02859v1
2026-05-08,Maritime AI,Data-Driven Vessel Trajectory Imputation,"The research presents a data-driven methodology for imputing missing vessel trajectory data to enhance the accuracy of mobility analysis in maritime logistics. By filling gaps in AIS and tracking records, the system improves the reliability of predictive modeling for port operations and safety.",5,Neutral,"['Trajectory Imputation', 'AIS', 'Mobility Analysis']",Data gaps are a pervasive problem in maritime tracking; robust imputation is the foundational 'cleanup' layer necessary for any sophisticated AI-driven logistics or collision avoidance system.,https://arxiv.org/abs/2602.11890
2026-05-08,Deep Space Tech,Radiation-Hardened FRAM Data Storage,Implementation of 8 Mbit FRAM modules (CY15B108QN) offers fast data write capabilities and low power consumption for deep space hardware. This technology provides the high radiation resistance necessary for data integrity in harsh orbital environments where traditional flash memory fails.,6,Bullish,"['FRAM', 'Radiation-Resistance', 'LEO Handover']","As constellations expand, the move toward radiation-hardened non-volatile memory like FRAM is critical for reducing power budgets while ensuring satellite longevity against cosmic rays.",https://github.com/topics/space-technology
2026-05-08,Deep Space Tech,Next-Generation Deep Space Propulsion,NASA's recent testing of novel propulsion technologies represents a major milestone in reducing transit times for interplanetary travel. These systems aim to unlock mission profiles for the outer solar system that were previously restricted by chemical rocket efficiency.,9,Bullish,"['Propulsion', 'Astrophysics', 'Space Exploration']","Breakthroughs in propulsion are the single most significant gatekeeper for deep space exploration, as they determine payload capacity and the viability of human missions to Mars.",https://www.reddit.com/r/space/comments/10ozjk9/nasa_tested_new_propulsion_tech_that_could_unlock/
2026-05-08,Deep Space Tech,Rapid Iteration in Heavy-Lift Reusability,"The Starship development cycle is shifting the industry focus toward reusable rockets as the primary vehicle for high-cadence satellite deployment and Mars logistics. While timeline realism remains a point of debate, the technical evolution of the Falcon 9 and Starship platforms continues to lower the cost-to-orbit.",8,Neutral,"['Starship', 'Reusable Rockets', 'Mars Mission']","The transition to fully reusable heavy-lift architectures is essential for building sustainable deep space infrastructure, even if mission timelines are subject to significant 'Elon Time' delays.",https://www.reddit.com/r/spacex/comments/1sslxn5/starship_development_thread_63/
2026-05-08,Deep Space Tech,AI-Driven Orbital Background Prediction,Researchers are applying deep learning to predict background noise in satellite anticoincidence systems based on orbital and attitude parameters. This optimization allows for higher precision in gamma-ray detection and instrument calibration without manual intervention.,5,Bullish,"['Deep Learning', 'Anticoincidence', 'Telemetry']","Integrating AI into orbital telemetry allows for smarter autonomous satellites that can process complex environmental data on the edge, which is vital for missions with high latency.",https://arxiv.org/abs/2404.02107
2026-05-08,Deep Space Tech,High-Dimensional Quantum Communication Links,New experiments utilize the orbital angular momentum (OAM) of single photons to scale the dimensionality of quantum communication systems. Hybrid quantum-classical workflows are being optimized to reduce the classical processing overhead that currently bottlenecks variational quantum eigensolvers.,7,Bullish,"['Orbital Angular Momentum', 'Quantum Communication', 'Rank-Stability Analysis']","Quantum communication via OAM provides a path toward secure, noise-robust data links across vast distances, a fundamental requirement for a future multi-planetary digital economy.",https://arxiv.org/list/quant-ph/new
2026-05-08,BioTech,Gilead Acquisition of Tubulis ADC Pipeline,"Gilead has expanded its oncology portfolio by acquiring Tubulis to integrate TUB-040, a next-generation Antibody-Drug Conjugate (ADC) targeting NaPi2b. The deal emphasizes the industry's shift toward site-specific conjugation technologies to improve therapeutic windows in solid tumor treatments.",8,Bullish,"['ADC', 'NaPi2b', 'Conjugation']",Continued M&A activity in the ADC space validates the platform's maturity and its role as a cornerstone for targeted cancer therapeutics in the coming years.,https://www.reddit.com/r/biotech/comments/1t0x27c/roundup_of_the_latest_antibody_biotech_deals/
2026-05-08,BioTech,Decentralized Clinical News Aggregation,Automated GitHub-based RSS scrapers are being utilized to monitor regional healthcare updates and clinical sentiments from major institutions like Xiangya Hospital. This infrastructure reflects a growing trend in using open-source tools for real-time monitoring of decentralized medical discourse.,3,Neutral,"['RSS Aggregation', 'Data Scraping', 'Clinical Monitoring']",The ability to track healthcare institutional news via automated workflows allows for rapid sentiment analysis and public health monitoring outside of traditional media channels.,https://github.com/zhaoolee/garss
2026-05-08,BioTech,CRISPR Safety and Prime Editing Toolkits,The OpenClaw-Medical-Skills repository provides critical computational tools for predicting CRISPR off-target effects and designing pegRNAs for prime editing. It integrates high-performance algorithms like MAGeCK and JACKS to quantify editing outcomes and ensure genomic safety.,9,Bullish,"['Prime Editing', 'Off-target Prediction', 'MAGeCK']",Standardizing open-source tools for genome engineering is essential for de-risking gene therapies and accelerating the path toward clinical safety assessments.,https://github.com/FreedomIntelligence/OpenClaw-Medical-Skills
2026-05-08,BioTech,Maintenance of Biopython Core Infrastructure,"The Biopython project continues to update its foundational library, focusing on the deprecation of obsolete modules to streamline biological computation. These updates ensure the longevity and reliability of Python-based workflows for sequence analysis and structural biology.",5,Neutral,"['Bioinformatics', 'Python', 'API Lifecycle']",Sustainable maintenance of core libraries is the 'invisible' work that enables reproducible research and stable production pipelines across the entire biotech sector.,https://github.com/biopython/biopython/blob/master/NEWS.rst
2026-05-08,BioTech,Advanced Spatial Transcriptomics Decomposition,"The SpaceXR platform introduces RCTD and C-SIDE algorithms for robust cell-type identification and differential expression analysis in spatial transcriptomics. A key technical feature is platform-effect normalization, which aligns scRNA-seq profiles with spatial pixel data.",9,Bullish,"['Spatial Transcriptomics', 'RCTD', 'scRNA-seq']","Overcoming the 'platform effect' allows for high-resolution mapping of tissue microenvironments, which is vital for understanding complex diseases like cancer and neurodegeneration.",https://github.com/dmcable/spacexr
2026-05-09,Software Engineering,Systemic Prompt Architecture,Developers are shifting from ad-hoc prompting to formal 'prompt architecture' integrated directly into software repositories. This evolution treats LLM instructions as modular code assets that require versioning and systematic design.,8,Bullish,"['Prompt Engineering', 'LLM Ops', 'Modular Design']","As AI integration matures, the industry is moving toward 'Prompts-as-Code,' requiring software engineers to apply traditional SDLC principles to generative AI workflows.",https://www.reddit.com/r/developer/
2026-05-09,Software Engineering,Apple Silicon Virtualization Friction,Engineers are reporting significant complexity and high entry barriers when attempting to run specialized VM workloads on M-series Mac hardware. The friction involved in cross-architecture virtualization for tools like Omarchy is leading to developer frustration and abandoned setups.,3,Bearish,"['Virtualization', 'Apple Silicon', 'ARM64']","Compatibility gaps in ARM-based development environments continue to hinder niche engineering workflows, potentially forcing teams to maintain legacy x86 hardware for specific dev-ops tasks.",https://github.com/basecamp/omarchy/discussions/452
2026-05-09,Software Engineering,Enterprise AI Security Consolidation,GitHub is bundling Advanced Security and Copilot for Business to create an enterprise-grade ecosystem for AI-assisted development. This integration focuses on combining high-velocity coding with automated governance and vulnerability scanning.,7,Bullish,"['DevSecOps', 'Copilot', 'Enterprise SaaS']","The professionalization of AI tools through enterprise-grade security features is essential for widespread corporate adoption, moving AI assistants from 'experimental' to 'mandatory' infrastructure.",https://github.com/jafshare/GithubTrending
2026-05-09,Software Engineering,Agentic Web Automation Frameworks,The rapid release cycle of the browser-use library signals a surge in tools that allow LLMs to autonomously interact with web browsers. This focus on agentic automation represents a leap beyond static API calls toward dynamic web-based task execution.,9,Bullish,"['Agentic AI', 'Browser Automation', 'Web Scraping']",Tools that enable AI to navigate the web like a human user are set to disrupt RPA (Robotic Process Automation) and software testing industries by reducing the need for manual script maintenance.,https://github.com/browser-use/browser-use/releases
2026-05-09,Software Engineering,Cloud Architect Credentialing Shift,"The industry is re-evaluating the path to becoming a Cloud Architect, weighing the value of multi-cloud certifications against senior engineering experience. There is a growing skepticism regarding 'paper architects' who lack deep system design foundations.",5,Neutral,"['Cloud Infrastructure', 'System Design', 'Professional Certification']","As cloud environments become increasingly complex, the market is pivoting toward prioritizing practical experience over theoretical certification, impacting how companies hire for senior infrastructure roles.",https://www.reddit.com/r/Cloud/comments/1t5nkkv/i_want_to_become_a_cloud_architect_but_most/
2026-05-09,Cybersecurity,Taxonomy and Tracking of Zero-Day Exploits,This research analyzes historical data from Google Project Zero and Zero-Day.cz to distinguish between novel attack behaviors and new vulnerabilities. It emphasizes the use of platforms like RAWGraphs to visualize exploit patterns for better defensive modeling.,6,Neutral,"['Zero-Day', 'Vulnerability Tracking', 'Behavioral Analysis']",Improving the categorization of zero-day threats allows the industry to move from reactive patching to predictive defense by identifying recurring architectural weaknesses.,https://arxiv.org/pdf/2605.03138
2026-05-09,Cybersecurity,Web3 Offensive Security and EVM Exploitation,"Emerging GitHub repositories are centralizing tools for EVM exploit development, focusing on reentrancy attacks and smart contract vulnerabilities. These resources facilitate automated blockchain hacking and proof-of-concept generation for decentralized finance protocols.",8,Bullish,"['Reentrancy', 'EVM', 'Solidity']","The growth of specialized offensive tools for Web3 indicates a maturing sub-sector where smart contract auditing is becoming a critical, high-stakes security requirement.",https://github.com/topics/exploit-poc
2026-05-09,Cybersecurity,Standardization of Zero-Day Governance,"Major threat intelligence reports from IBM and Google Cloud confirm a rising volume of zero-day disclosures, with 75 identified in 2024 alone. Industry experts are now calling for a centralized registry and standardized taxonomy to improve transparency and response coordination.",5,Bullish,"['Threat Intelligence', 'Governance', 'Standardization']",Formalizing how zero-days are reported and categorized is essential for global supply chain security and cross-vendor interoperability during major incidents.,https://arxiv.org/html/2605.03138v1
2026-05-09,Cybersecurity,Windows Kernel and Application Privilege Escalation,Public PoC implementations for CVE-2025-8088 and driver-level vulnerabilities in Wacom devices demonstrate active exploitation of Windows local privilege escalation. These C++ tools provide functional templates for bypassing system-level security boundaries through symbolic link attacks.,7,Bearish,"['Local Privilege Escalation', 'PoC', 'WinRAR']",The persistent release of public exploits for legacy and driver software highlights the ongoing risk that unpatched endpoint vulnerabilities pose to enterprise perimeters.,https://github.com/topics/zero-day?l=c%2B%2B
2026-05-09,Cybersecurity,AI-Powered Payload Synthesis and Research,"Next-generation frameworks like WAFMANCER and DeepZero utilize AI agents and Graph Neural Networks to automate WAF evasion and kernel driver analysis. These multimodal systems can decompile code and synthesize payloads natively, significantly lowering the barrier for complex exploit discovery.",9,Bullish,"['AI-Powered Payload', 'GNN', 'WAF Evasion']","The weaponization of AI agents for vulnerability research marks a transition to an era where defensive layers must adapt in real-time to machine-generated, metamorphic threats.",https://github.com/topics/zero-day?o=desc&s=updated
2026-05-09,Maritime AI,Sim-to-Real Transfer for Autonomous Navigation,"This research introduces Sim2Sea, a framework designed to transfer maritime navigation policies from simulated environments to real-world congested waters. The approach utilizes the AquaNav simulator to train autonomous agents to handle complex multi-agent interactions before deployment.",9,Bullish,"['Sim-to-Real', 'Reinforcement Learning', 'Multi-Agent Systems']","Solving the sim-to-real gap is the 'holy grail' for autonomous shipping; it allows for safe, low-cost training of navigation AI that can survive the unpredictable nature of open-sea and harbor environments.",https://arxiv.org/html/2603.04057v1
2026-05-09,Maritime AI,Satellite Vessel Detection via Selective Search,"This project implements a deep learning pipeline using Convolutional Neural Networks and Selective Search for identifying ships in satellite imagery. By utilizing region proposal techniques instead of standard YOLO architectures, it offers a specialized approach to maritime object detection.",6,Bullish,"['CNN', 'Selective Search', 'Computer Vision']","High-accuracy satellite detection is critical for global logistics and maritime security, providing a scalable way to monitor vessel traffic where AIS data might be unavailable or spoofed.",https://github.com/2D-array/maritime-vessel-detection
2026-05-09,Maritime AI,Real-Time Maritime Data Engineering,The integration of Kafka and Spark Structured Streaming enables the processing of high-velocity AIS data for real-time vessel tracking and anomaly detection. These full-stack applications facilitate intelligent destination decoding and suspicion tracking across global shipping lanes.,7,Bullish,"['Kafka', 'Spark Streaming', 'AIS']","The maritime industry is shifting from retrospective data analysis to real-time operational intelligence, requiring robust data engineering pipelines to handle the massive influx of sensor data.",https://github.com/topics/maritime-data
2026-05-09,Maritime AI,AIS Trajectory Signature Classification,This research applies handwriting signature verification techniques to maritime AIS data to classify vessel types based on their trajectory patterns. The model is specifically tuned to identify non-cooperative vessels in strategic regions like the Black Sea.,8,Bullish,"['Trajectory Analysis', 'Non-cooperative Vessels', 'Anomaly Detection']",Using behavioral 'signatures' rather than just static identifiers allows authorities to detect 'dark' vessels or ships attempting to hide their identity through illicit maneuvering patterns.,https://github.com/Navy-APh/HSV-Maritime-Vessel-Clasification
