date,domain,topic,summary,hype_score,sentiment,keywords,narrative,link
2026-05-09,Maritime AI,Geospatial API Frameworks for Maritime GIS,The release of specialized GIS extensions for web frameworks provides stabilized support for GeoJSON and spatial querying in maritime applications. These tools allow for the seamless integration of vessel location data into scalable web-based monitoring dashboards.,4,Neutral,"['PostGIS', 'GeoJSON', 'REST API']","While more foundational than 'hype-driven,' robust geospatial tooling is essential for the democratization of maritime data, allowing smaller startups to build professional-grade tracking platforms.",https://github.com/openwisp/django-rest-framework-gis/releases/tag/v1.0.0
2026-05-09,Deep Space Tech,Advanced Deep Space Propulsion Systems,NASA's testing of experimental propulsion technologies marks a critical step toward enabling long-duration interplanetary missions. These systems focus on high-efficiency thrust mechanisms designed to reduce transit times for human and robotic deep space exploration.,9,Bullish,"['Rotating Detonation', 'Specific Impulse', 'Interplanetary Transit']",Breakthroughs in propulsion are the primary bottleneck for deep space colonization; these tests validate the feasibility of reaching Mars and beyond more sustainably.,https://www.reddit.com/r/space/comments/10ozjk9/nasa_tested_new_propulsion_tech_that_could_unlock/
2026-05-09,Deep Space Tech,Open-Source Space Data Democratization,The emergence of modern web dashboards for NASA JPL’s Horizons System enables intuitive access to complex orbital mechanics and spacecraft trajectory data. This movement toward open-source directories facilitates collaborative development and education across the global space technology sector.,6,Bullish,"['Ephemeris Data', 'Orbital Mechanics', 'API Integration']",Reducing the barrier to entry for astronomical data allows startups and academic institutions to build sophisticated navigation tools without proprietary overhead.,https://github.com/topics/space-technology
2026-05-09,Deep Space Tech,Deep Learning for Satellite Instrumentation,"Researchers are deploying deep learning models to predict background noise in satellite anticoincidence systems by analyzing orbital and attitude parameters. This approach optimizes data cleaning for high-energy astrophysics missions, ensuring higher fidelity in cosmic signal detection.",7,Neutral,"['Neural Networks', 'Anticoincidence Systems', 'Astrophysical Phenomena']","As satellite constellations grow more complex, AI-driven autonomous calibration is essential for maintaining the integrity of sensitive scientific instruments in orbit.",https://arxiv.org/abs/2404.02107
2026-05-09,Deep Space Tech,AI-Enhanced Space Software Development,The integration of AI-powered coding assistants and advanced security features on platforms like GitHub is streamlining the development of mission-critical space software. These tools provide enterprise-grade protection and automated code generation for increasingly complex aerospace repositories.,5,Bullish,"['Copilot', 'DevSecOps', 'Code Scanning']",The reliability of space missions depends on error-free code; AI-assisted development pipelines reduce human error and accelerate the deployment of flight software.,https://github.com/jafshare/GithubTrending
2026-05-09,Deep Space Tech,Virtual Simulation and Space Visualization,"High-fidelity virtual environments and space-themed simulations continue to drive public engagement and conceptual modeling for futuristic space habitats. These platforms push the boundaries of real-time rendering and complex networking, which are vital for remote mission training.",3,Neutral,"['Rendering Engines', 'Virtual Simulation', 'Network Latency']","While entertainment-focused, the underlying tech in high-end space simulations often paves the way for digital twin technologies used in astronaut training and mission planning.",https://www.reddit.com/r/DestinyTheGame/
2026-05-09,BioTech,Widespread Biotech Workforce Reductions,Multiple biotech firms including atai Life Sciences and MorphoSys AG are implementing staff cuts of up to 70% to preserve capital. These measures are specifically designed to extend cash runways through 2026 by shuttering pre-clinical programs and reducing operational overhead.,2,Bearish,"['WARN Notice', 'Cash Runway', 'Pre-clinical Programs']",This indicates a period of severe financial consolidation in the sector where survival and capital preservation take precedence over early-stage R&D expansion.,https://www.reddit.com/r/biotech/comments/11ux0r9/biotech_layoffs_coming_in_few_months_60days_from
2026-05-09,BioTech,FDA Clinical Trial Requirement Streamlining,The FDA has officially transitioned to a default policy of requiring only one pivotal clinical trial for certain drug applications. This regulatory shift is intended to accelerate the path to market and reduce the massive costs associated with redundant Phase III testing.,8,Bullish,"['Pivotal Trial', 'Drug Application', 'Regulatory Approval']",Reducing the clinical trial burden is a major tailwind for the industry that could significantly shorten development timelines and lower the barrier to entry for smaller biotech firms.,https://www.reddit.com/r/biotech/comments/1r9ac83/its_official_fda_will_now_default_to_one_clinical
2026-05-09,BioTech,Longevity Science and AI-Enhanced Trials,Research into biological age reversal is moving toward systemic human deployment trials scheduled for 2026. The integration of Artificial Super Intelligence (ASI) is being positioned as a critical tool to accelerate these clinical timelines and predict outcomes more accurately.,9,Bullish,"['Biological Age', 'ASI', 'Systemic Deployment']",The intersection of longevity science and high-level AI represents a high-upside frontier that could redefine the market for age-related therapeutics.,https://www.reddit.com/r/singularity/comments/1rcszgl/dr_david_sinclair_whose_lab_reversed_biological/
2026-05-09,BioTech,Spatial Transcriptomics Computational Tools,The spacexr R package enables robust decomposition of cell type mixtures through Robust Decomposition of Cell Type Mixtures (RCTD). This technical framework allows researchers to identify cell-type-specific differential expression within complex spatial transcriptomics datasets.,6,Bullish,"['Spatial Transcriptomics', 'RCTD', 'Differential Expression']","Advanced bioinformatics tools like this are essential for precision medicine, as they provide the granular data needed to understand how drugs interact with specific cell types in their natural tissue environment.",https://github.com/dmcable/spacexr
2026-05-09,BioTech,AI Agent Integration in Clinical Research,"The OpenClaw project has released a library of 869 specialized AI agent skills focused on biomedical and clinical research. These skills allow autonomous agents to handle complex tasks across the research spectrum, from data mining to experimental design.",7,Bullish,"['AI Agents', 'Clinical Research', 'Biomedical Automation']",The shift toward autonomous AI agents in the lab suggests a forthcoming surge in research productivity and a reduction in the manual labor required for large-scale clinical data analysis.,https://github.com/FreedomIntelligence/OpenClaw-Medical-Skills
