date,domain,topic,summary,hype_score,sentiment,keywords,narrative,link
2026-05-11,Cybersecurity,Predictive AI-Driven IoT Intrusions,Technical projections for 2026 highlight a surge in AI-augmented attacks targeting the privacy and physical security of IoT-enabled homes. This trend focuses on the intersection of machine learning and consumer-grade device exploitation.,7,Bearish,"['AI-Driven Cyberattacks', 'IoT Security', 'Threat Landscape']","The convergence of AI and IoT necessitates a shift in consumer security from basic perimeter defense to sophisticated, predictive behavioral monitoring.",https://github.com/rix4uni/medium-writeups
2026-05-11,Cybersecurity,Advanced EDR Evasion & Ransomware Simulation,Research repositories are detailing sophisticated techniques used by zero-day ransomware to bypass traditional Endpoint Detection and Response (EDR) systems. These simulations aim to help defensive developers understand and mitigate adaptive malware strains that exploit unknown vulnerabilities.,8,Neutral,"['EDR Evasion', 'Ransomware Simulation', 'Adaptive Malware']",Understanding the 'how' behind EDR bypass is essential for building the next generation of AI-driven defense mechanisms that can detect malware based on behavior rather than signatures.,https://github.com/Prosfinity/Zero-Day-Ransomware-Bypass-All-EDR-s
2026-05-11,Consumer Tech,Strategic Evolution of Spatial Computing,The Vision Pro represents a long-term hardware roadmap that may take over five years to reach maturity and mass adoption. Market sentiment suggests that lightweight smart glasses currently hold more mainstream appeal than bulky high-performance VR headsets.,7,Neutral,"['Spatial Computing', 'Form Factor', 'Mixed Reality']","This highlights the tension between high-end computing power and wearable ergonomics. The industry is currently debating whether the future of consumer AR lies in powerful tethered experiences or lower-powered, stylish smart glasses.",https://www.reddit.com/r/VisionPro/comments/1rxk7ko/i_hope_apple_doesnt_abandon_the_vision_pro_at/
2026-05-11,Consumer Tech,AI-Driven Assistive Wearable Platforms,New wearable systems are integrating deep learning architectures like YOLO and Faster R-CNN to provide real-time environment comprehension for visually impaired users. These platforms combine multimodal sensors with GPS and text-to-speech to bridge the gap between digital data and physical navigation.,8,Bullish,"['YOLO', 'Computer Vision', 'Multimodal AI']",Assistive technology is often a precursor to mainstream features; the successful integration of real-time object detection in wearables proves the technical feasibility of ubiquitous AI-augmented reality.,https://arxiv.org/pdf/2505.10875
2026-05-11,Consumer Tech,Next-Gen AR Smart Glasses Hardware (2026),The 2026 hardware cycle is expected to feature high-resolution 50MP Omnivision sensors and Full-Color MicroLED engines in consumer-grade frames. These advancements aim to provide a competitive alternative to Meta’s Ray-Ban glasses by offering superior display quality and imaging at a $500-$600 price point.,9,Bullish,"['MicroLED', 'Omnivision', 'Smart Glasses']",The transition to MicroLED and high-megapixel sensors in slim form factors marks a critical inflection point where smart glasses move from basic audio wearables to true visual AR devices.,https://www.reddit.com/r/SmartGlasses/comments/1pxrb2f/upcoming_arai_smart_glasses_in_2026/
2026-05-11,Consumer Tech,Economic Friction in Handheld Gaming Markets,"Handheld gaming faces significant adoption barriers in emerging markets like Brazil due to high import taxes and economic instability. Despite technical innovations in the SBC (Single Board Computer) gaming space, price sensitivity remains the primary obstacle for global expansion.",4,Bearish,"['SBC Gaming', 'Market Penetration', 'Supply Chain']",Hardware manufacturers must address regional pricing and local manufacturing if they wish to move beyond niche enthusiast markets into the massive global 'average consumer' demographic.,https://www.reddit.com/r/SBCGaming/comments/1qgnzmy/handheld_gaming_in_brazil_is_almost_unviable_for
2026-05-11,Consumer Tech,Consumer Demand for Digital Night Vision,"There is a resurgent interest in affordable, modern handheld camcorders that offer digital night vision and solid-state storage. Consumers are looking to replace legacy tape-based systems with sub-$300 digital devices that maintain specialized low-light recording capabilities.",5,Bullish,"['Night Vision', 'Infrared', 'Solid State Storage']",The demand for specialized niche sensors (like IR/Night Vision) in entry-level consumer electronics suggests a 'prosumer' trend where users want specific utility features that standard smartphones still struggle to replicate.,https://www.reddit.com/r/camcorders/comments/1g5c0ab/best_handheld_camcorder_with_night_vision_under/
2026-05-11,FinTech & Web3,AI-Native Compliance for Autonomous Payments,"This signal identifies a new layer of compliance infrastructure specifically designed for AI agents, integrating real-time sanctions screening and FATF Travel Rule protocols. These systems use cryptographic receipts and zk-compliance to enable high-speed, programmable stablecoin transactions within decentralized dollar engines.",9,Bullish,"['zk-compliance', 'FATF Travel Rule', 'AI Agent Payments']","As autonomous AI agents begin to manage capital, the industry is pivoting toward automated, machine-readable compliance layers that satisfy global regulators without introducing human-latency bottlenecks.",https://github.com/topics/stablecoin?o=asc&s=stars
2026-05-11,FinTech & Web3,Multi-Chain Stablecoin Utility and Yield Aggregation,"Development is expanding beyond simple pegged assets toward niche utility, including gold-backed Solana tokens and fee-free digital dollar protocols like x402. New 'Yield Terminals' are consolidating cross-chain liquidity via CCTP bridges to offer standardized vaults for stablecoin holders.",7,Bullish,"['CCTP Bridge', 'ERC20 Blacklisting', 'Yield Aggregation']","The saturation of basic stablecoins is driving a shift toward 'Yield-as-a-Service,' where the value proposition moves from simple value storage to automated, cross-chain capital efficiency.",https://github.com/topics/stablecoin?o=desc&s=updated
2026-05-11,FinTech & Web3,Institutionalization of DeFi Trading Frameworks,High-volume forking of the web3-ethereum-defi repository indicates a surge in the development of sophisticated algorithmic trading infrastructure. These frameworks provide the standardized primitives necessary for automated liquidity provision and complex decentralized exchange interactions.,6,Bullish,"['Ethereum DeFi', 'Algorithmic Trading', 'Smart Contract Forks']","The rapid adoption of professional-grade trading libraries by multiple independent entities suggests that DeFi is moving toward a more institutional 'Quant' phase, requiring robust execution engines.",https://github.com/tradingstrategy-ai/web3-ethereum-defi/forks?include=active&period=2y&sort_by=stargazer_counts
2026-05-11,FinTech & Web3,Modular Quant Finance Tooling,The decentralization of trading-specific codebases allows developers to build modular execution engines and proprietary trading bots. This activity highlights a trend toward open-source democratization of sophisticated financial tools that were previously gated.,5,Neutral,"['Open-Source', 'Web3 Quant', 'EVM Interaction']","While modularity accelerates innovation, the heavy reliance on a few core trading libraries creates systemic risk if vulnerabilities are discovered in the foundational open-source code.",https://github.com/tradingstrategy-ai/web3-ethereum-defi/forks
2026-05-11,FinTech & Web3,Security-First DeFi Strategy Development,The involvement of specialized auditing firms in forking DeFi strategy repositories signals a move toward 'audit-by-design' for automated finance. This focus ensures that high-frequency trading bots and liquidity strategies are pre-vetted for common smart contract vulnerabilities.,8,Bullish,"['Smart Contract Audit', 'Web3 Ethereum', 'Liquidity Provision']","As Total Value Locked (TVL) in automated strategies grows, the integration of security auditing directly into the development lifecycle is becoming a critical requirement for institutional-grade DeFi.",https://github.com/tradingstrategy-ai/web3-ethereum-defi/forks?include=active&period=2y&sort_by=open_issue_counts
2026-05-13,AI & LLM Frontier,ACDL: Formalizing Agentic Context Assemblies,"The proposed Agentic Context Description Language (ACDL) provides a standardized, unambiguous syntax for describing how LLM context windows are constructed and modified across multi-step interactions. This framework replaces ad-hoc descriptions of training data and interaction histories with a unified formal language for developers.",6,Bullish,"['ACDL', 'Context Construction', 'Agentic LLM']","As agentic workflows become more complex, the industry requires a rigorous way to document and reproduce context-handling strategies to ensure model reliability and interoperability.",https://arxiv.org/html/2605.01920v1
2026-05-13,AI & LLM Frontier,2026 Frontier Model Benchmarking and Sentiment,"User sentiment in 2026 indicates a strong preference for Anthropic's Claude due to its superior human-like reasoning and efficient coding capabilities compared to GPT and Gemini. The shift highlights a market prioritizing concise, high-utility outputs over broader, more verbose general-purpose responses.",8,Bullish,"['Claude 4.5', 'Coding Capabilities', 'Data Analysis']","The hierarchy of frontier LLMs is stabilizing around specific utility strengths, with Anthropic leading in developer productivity and human-centric interaction, forcing competitors to specialize.",https://www.reddit.com/r/artificial/comments/1qo7psc/what_are_your_top_llm_picks_in_2026_and_why/
2026-05-13,AI & LLM Frontier,Open-Weight Specialization in Local Ecosystems,The 2026 local LLM landscape is characterized by a shift toward specialized open-weight models optimized for agentic coding and private search augmentation. Community efforts are focused on high-density performance for professional-grade applications running on local hardware.,7,Bullish,"['Open Weights', 'LocalLLaMA', 'Agentic Tool Use']","The rise of performant local models democratizes access to agentic tools, allowing enterprises to maintain data sovereignty while matching the performance of proprietary APIs.",https://www.reddit.com/r/LocalLLaMA/comments/1sknx6n/best_local_llms_apr_2026/
2026-05-13,AI & LLM Frontier,Subagent Offloading with Terminus-4B,Terminus-4B demonstrates the efficiency of using Small Language Models (SLMs) to handle verbose terminal execution and diagnostic subtasks in coding workflows. This architecture preserves the primary agent's context window by filtering and summarizing massive logs before passing them back to the frontier model.,9,Bullish,"['SLM', 'Context Optimization', 'Terminal Execution']",Managing context window 'pollution' is the next major hurdle for software agents; offloading repetitive execution tasks to specialized SLMs is the emergent architectural solution.,https://arxiv.org/html/2605.03195v1
2026-05-13,AI & LLM Frontier,TREX: Autonomous Agent-Driven Fine-tuning,"The TREX system automates the fine-tuning process by employing a multi-agent hierarchy of 'Researchers' and 'Executors' to explore tree-based experimental designs. By utilizing models like Gemini 3 Pro and Claude 4.5 Sonnet, the system conducts autonomous, multi-round iterations for model improvement.",8,Bullish,"['Tree-based Exploration', 'Automated Fine-tuning', 'AI-Augmented Research']","The transition from human-led to agent-led model optimization marks the beginning of self-improving AI cycles, significantly accelerating the pace of LLM evolution.",https://arxiv.org/html/2604.14116v2
2026-05-13,Cybersecurity,Multi-Vector Threat Convergence 2026,Defenders in 2026 are facing a systemic crisis as three distinct accelerating threat vectors converge simultaneously against legacy security processes. This environment creates a critical gap where human-led response times cannot keep pace with automated multi-stage attacks.,6,Bearish,"['Attack Surface', 'Defense-in-Depth', 'Security Orchestration']","As threat actors leverage automation to scale attacks, the industry must transition from manual intervention to autonomous security operations to prevent total defender burnout.",https://www.reddit.com/r/cybersecurity/comments/1q05vev/what_is_your_most_anticipated_cybersecurity_risk/
2026-05-13,Cybersecurity,Blue Hammer Zero-Day Disclosure,"Public exploit code has been released for a new vulnerability known as Blue Hammer, officially tracked as CVE-2026-33825. The availability of this code significantly lowers the barrier for entry for script kiddies and sophisticated actors alike to target unpatched systems.",8,Bearish,"['CVE-2026-33825', 'Exploit Code', 'Zero-Day']","The rapid weaponization of newly discovered vulnerabilities forces organizations into a 'race-to-patch,' highlighting the fragility of modern software supply chains.",https://www.reddit.com/r/cybersecurity/comments/1ss9vw1/any_info_on_the_new_zero_day_recently/
2026-05-13,Cybersecurity,Browser Ingress Exploitation Trends,"Google has patched CVE-2026-5281, marking the fourth Chrome zero-day vulnerability exploited in the wild within the first half of 2026. This recurring pattern emphasizes that the web browser remains the primary and most volatile ingress point for enterprise compromises.",7,Bearish,"['Chromium', 'Memory Corruption', 'Patch Management']",Persistent targeting of browsers necessitates a shift toward browser isolation and more aggressive endpoint detection strategies to mitigate client-side risks.,https://www.reddit.com/r/cybersecurity/comments/1s9pq7e/google_fixes_fourth_chrome_zeroday_exploited_in/
2026-05-13,Cybersecurity,Fortinet Infrastructure Exploitation,"A critical zero-day vulnerability in Fortinet products, CVE-2026-35616, is currently being actively exploited by advanced persistent threat actors. Security teams are advised to prioritize immediate firmware updates as the vulnerability allows for unauthorized access to network perimeters.",9,Bearish,"['FortiOS', 'Perimeter Security', 'Edge Vulnerability']",Vulnerabilities in edge infrastructure like Fortinet are high-value targets because they allow attackers to bypass traditional firewalls and move laterally within a network.,https://www.reddit.com/r/cybersecurity/comments/1scm5bc/fortinet_cve202635616_actively_exploited_as_zero/
2026-05-13,Cybersecurity,Qilin Ransomware Campaign Expansion,"The Qilin ransomware group has expanded its victim list on the dark web, notably adding The Gravity Group and Sheriff Security Company. This move demonstrates the group's ongoing capability to breach specialized firms and utilize double-extortion tactics to ensure payment.",5,Bearish,"['Double Extortion', 'Ransomware-as-a-Service', 'Data Exfiltration']",The continued success of ransomware syndicates like Qilin proves that data exfiltration remains a potent weapon against corporate reputation and operational continuity.,https://twitter.com/FalconFeedsio
2026-05-13,Consumer Tech,Assistive Computer Vision Wearables,Advancements in YOLO and Faster R-CNN deep learning architectures are enabling lightweight wearables to perform real-time scene comprehension and object identification. These systems integrate GPS and multimodal feedback to provide spatial awareness for individuals with visual impairments.,8,Bullish,"['YOLO', 'Faster R-CNN', 'Computer Vision']",The integration of high-speed object detection into consumer wearables shifts the market from basic fitness tracking toward high-utility assistive devices that expand accessibility and independence.,https://arxiv.org/pdf/2505.10875
2026-05-13,Consumer Tech,Temporal Grounding in LLM Search,Leaked system prompts for Claude 4.6 reveal sophisticated temporal grounding protocols designed to synchronize AI search queries with the actual calendar year. This mechanism prevents stale data retrieval by bridging the gap between the model's 2025 knowledge cutoff and the 2026 operational environment.,9,Bullish,"['Temporal Grounding', 'LLM', 'Knowledge Cutoff']","Solving temporal drift is critical for the reliability of AI agents; if models cannot accurately distinguish current events from historical data, their utility in real-time consumer search is severely diminished.",https://github.com/asgeirtj/system_prompts_leaks/blob/main/Anthropic/claude-opus-4.6.md
2026-05-13,Consumer Tech,Hardware Affordability in Emerging Markets,Handheld gaming hardware faces significant adoption barriers in Brazil due to prohibitive import taxes and local economic constraints. This creates a market gap where premium mobile gaming hardware remains unviable for the average consumer despite high interest.,4,Bearish,"['Import Taxes', 'SBCGaming', 'Emerging Markets']","The disconnect between global hardware innovation and regional economic policy limits the total addressable market for gaming manufacturers, potentially forcing a shift toward low-cost cloud gaming solutions.",https://www.reddit.com/r/SBCGaming/comments/1qgnzmy/handheld_gaming_in_brazil_is_almost_unviable_for
2026-05-13,Consumer Tech,Decentralized Web Monetization Standards,New open-source standards like Web Monetization are emerging to facilitate direct browser-to-content financial transfers without traditional ad-tech intermediaries. These projects prioritize privacy and ad-free alternatives within the consumer software ecosystem.,6,Neutral,"['Web Monetization', 'Open Source', 'Smart Home']","As consumers become increasingly fatigued by ad-supported models, standardized open-source protocols provide a pathway for alternative revenue streams that could disrupt current big-tech platform models.",https://github.com/imq/awesome-projects
2026-05-13,Consumer Tech,Model Context Protocol (MCP) Infrastructure,The development of the ToolSDK MCP Registry enables standardized integration between Large Language Models and personal productivity tools like Gmail. This registry uses the Model Context Protocol to allow natural language interfaces to perform complex data retrieval and interaction tasks.,7,Bullish,"['MCP Registry', 'ToolSDK', 'Natural Language Management']",Standardization of tool-calling through MCP is essential for the transition from passive AI chatbots to active AI agents that can manage a user's entire digital ecosystem through a unified interface.,https://github.com/toolsdk-ai/toolsdk-mcp-registry
2026-05-13,FinTech & Web3,Regulatory Interoperability Protocols,This protocol facilitates seamless asset transfers between traditional financial institutions and DeFi platforms by integrating high-level regulatory recommendations. It establishes a technical framework for tokenized capital markets to remain compliant while leveraging decentralized liquidity.,8,Bullish,"['Tokenization', 'Interoperability', 'DeFi']","Bridging the gap between TradFi and DeFi is the 'holy grail' for institutional adoption, allowing trillions in capital to flow into on-chain environments safely.",https://arxiv.org/html/2603.29278v1
2026-05-13,FinTech & Web3,Jurisdictional Compliance for Web3 Banking,Securing traditional banking for Web3 entities requires a proactive demonstration of regulatory foresight regarding specific jurisdictional concerns. Success in the sector now depends as much on 'compliance-by-design' as it does on core product features.,6,Neutral,"['Jurisdiction', 'Fiat-Onramp', 'KYC/AML']",Operational stability for Web3 startups remains a bottleneck; solving the banking access problem is essential for the industry's survival and growth.,https://www.reddit.com/r/fintech/comments/1snajlc/how_do_companies_operating_in_web3_open/
2026-05-13,FinTech & Web3,API-Driven Non-Custodial Cross-Border Payments,"By 2026, a robust ecosystem of liquidity providers and virtual cards is expected to support non-custodial projects for international settlement. Utilizing API integrations allows these projects to bypass traditional banking hurdles while maintaining decentralization.",7,Bullish,"['Non-Custodial', 'API', 'Liquidity']","As cross-border payment rails modernize, non-custodial solutions will offer cheaper and faster alternatives to legacy SWIFT-based systems.",https://www.reddit.com/r/fintech/comments/1t4hvi5/regulatory_hurdles_in_blockchain_consulting_for/
2026-05-13,FinTech & Web3,AI Agent Integration in Enterprise Ledgers,Industry leaders are shifting focus toward the role of autonomous agents in managing enterprise supply chains and compliance protocols. This transition emphasizes the use of distributed ledgers as a trust layer for automated machine-to-machine interactions.,9,Bullish,"['Autonomous Agents', 'Supply Chain', 'Distributed Ledger']",The convergence of AI and blockchain (Web3) creates a programmable trust layer that could automate the majority of global trade logistics.,https://www.reddit.com/r/Hedera/comments/1t5l0rk/day_2_at_consensus2026_dr_leemon_talking_about/
2026-05-13,FinTech & Web3,Infrastructure Resilience Beyond the Ledger,"Future blockchain success depends on solving 'at the edge' issues like identity, governance, and incentive structures rather than just ledger throughput. Most non-financial projects fail because they neglect these human-centric technical hurdles.",5,Neutral,"['Identity', 'Governance', 'Incentives']","This signals a maturity phase where the industry realizes that the 'blockchain' part is solved, but the 'utility' part requires better social and technical middleware.",https://www.reddit.com/r/BlockchainStartups/comments/1r93avq/lets_be_real_we_need_to_talk_about_the_future_of/
2026-05-12,AI & LLM Frontier,Standardizing Agentic Context Languages,"This research introduces ACDL, a formal language designed to precisely describe how inputs are assembled and managed within agentic LLM loops. By reverse-engineering popular agents like OpenCode and OpenClaw, the authors address the critical need for a standardized protocol in context construction.",6,Bullish,"['ACDL', 'Agentic LLM', 'Context Construction']","As autonomous agents become more complex, the industry needs a common technical vocabulary to describe their internal state and context handling to ensure interoperability and debugging efficiency.",https://arxiv.org/html/2605.01920v1
2026-05-12,AI & LLM Frontier,SLM Specialization for Agentic Subtasks,"The Terminus-4B project demonstrates that a 4-billion parameter model, post-trained via SFT and Reinforcement Learning, can replace massive frontier models for specialized terminal execution tasks. This architecture allows main agents to delegate verbose subtasks to smaller models, keeping the primary context window efficient and clean.",8,Bullish,"['SLM', 'SFT', 'Reinforcement Learning']","The shift toward 'subagent' architectures using Small Language Models (SLMs) signals a move away from monolithic model reliance toward cost-effective, specialized AI hierarchies.",https://arxiv.org/html/2605.03195v1
2026-05-12,AI & LLM Frontier,Democratization of Fine-Tuning SDKs,Emerging GitHub projects like Simplifine and Multimind-SDK are offering one-line commands and unified interfaces for fine-tuning both local and hosted LLMs. These tools integrate popular optimization frameworks and Hybrid RAG capabilities to make enterprise-ready AI customization accessible to a broader developer base.,7,Bullish,"['Hybrid RAG', 'Optimization Frameworks', 'SDK']","Lowering the technical barrier to fine-tuning empowers domain-specific industries to build high-performance, private models without requiring deep machine learning expertise.",https://github.com/topics/fine-tuning-llm
2026-05-12,AI & LLM Frontier,Local Inference and Ecosystem Integration,The proliferation of tools like Ollama-php and Aikits indicates a maturing ecosystem for running and deploying open-source LLMs on local infrastructure. These projects bridge the gap between complex model architectures and mainstream application environments like PHP and enterprise cloud deployments.,7,Bullish,"['Ollama', 'Local Inference', 'aikit']",The expansion of LLM support into traditional web languages and local hosting tools reflects a growing demand for data privacy and reduced latency in AI application development.,https://github.com/topics/open-source-llm
2026-05-12,AI & LLM Frontier,Automated Agent-Driven Model Training,"TREX is a new framework that uses agent-driven tree-based exploration to automate the complex process of LLM fine-tuning and hyperparameter optimization. By parallelizing experimental plans and data mixing ratios, it significantly maximizes the efficiency of large-scale cluster computing resources.",9,Bullish,"['Tree-based Exploration', 'Hyperparameter Tuning', 'FT-Bench']","Automating the 'black art' of model training with AI agents accelerates the R&D cycle, moving the industry closer to self-optimizing systems that reduce the need for manual human engineering.",https://arxiv.org/html/2604.14116v2
2026-05-12,The AI Bubble (Infra),Global AI Infrastructure Hyper-Expansion,"Annual AI infrastructure spending is projected to reach $700 billion by 2026, driven by a 2-year compression of data center construction timelines and massive GPU procurement. Supply chain constraints are intensifying, specifically regarding HBM3e memory demand and liquid cooling system capacity.",10,Bullish,"['HBM3e', 'Liquid Cooling', 'Advanced Packaging']","The scale of investment represents the largest capital deployment in history, signaling a 'total war' for compute supremacy that fundamental shifts the global semiconductor and energy landscape.",https://www.reddit.com/r/ThinkingDeeplyAI/comments/1r0ndyv/700_billion_will_be_invested_in_the_ai/
