date,domain,topic,summary,hype_score,sentiment,keywords,narrative,link
2026-05-12,The AI Bubble (Infra),Rise of Custom ASIC & Workload-Specific Silicon,"Hyperscalers are pivoting toward custom silicon like Google's TPU and Meta's MTIA to optimize for specific training workloads rather than general-purpose compute. Broadcom is emerging as a dominant provider of the underlying IP, networking, and packaging required for these custom accelerators.",8,Bullish,"['Custom ASIC', 'TPU', 'Networking IP']","This shift indicates a maturation of the market where efficiency and workload optimization are becoming as critical as raw power, reducing the long-term monopoly of general-purpose GPUs.",https://www.reddit.com/r/investing/comments/1rn6ntl/broadcom_q1_fy2026_the_ai_infrastructure_story/
2026-05-12,The AI Bubble (Infra),Infrastructure Sector Rotation & Relative Value,"Market analysts are shifting focus from overextended compute stocks to lagging sectors like power distribution, critical minerals, and AI-linked healthcare. This relative-performance screening aims to find secondary infrastructure layers that haven't yet reached peak valuation.",5,Neutral,"['Critical Minerals', 'Optical Networking', 'Power Distribution']","As primary compute winners become priced for perfection, the investment narrative is broadening to include the 'boring' physical utilities and materials essential for sustaining the buildout.",https://www.reddit.com/r/investing/comments/1szemcc/i_tried_to_find_which_ai_infrastructure_sector/
2026-05-12,The AI Bubble (Infra),Enterprise AI ROI Sustainability Gap,Concerns are mounting over the disparity between $10M+ infrastructure investments and sub-$1M labor cost savings within Fortune 500 companies. This fiscal mismatch suggests that current enterprise AI deployments are driven more by 'digital transformation' optics than tangible bottom-line results.,4,Bearish,"['AI Agents', 'ROI Analysis', 'Digital Transformation']","If enterprises cannot bridge the gap between massive capex and actual revenue or cost-efficiency, the infrastructure buildout may face a sharp correction as CFOs demand evidence of value.",https://www.reddit.com/r/AI_Agents/comments/1rzwbn5/2026_enterprise_ai_roi_in_a_nutshell/
2026-05-12,The AI Bubble (Infra),Hyperscale Contractual Lock-in and Vertical Integration,"Meta has committed to $237 billion in non-cancelable contractual obligations for cloud and infrastructure to prevent capacity constraints for future model families. To mitigate these extreme costs, they are accelerating the rollout of in-house silicon developed in partnership with Broadcom.",9,Neutral,"['MTIA', 'Capex Intensity', 'Contractual Commitments']","The transition to 'non-cancelable' commitments reflects a high-stakes bet on model scaling, forcing hyperscalers into vertical integration to escape the margin pressure of third-party providers.",https://www.reddit.com/r/ValueInvesting/comments/1t16ndd/meta_meta_q1_2026_33_revenue_growth_vs_the_237b/
2026-05-12,Cybersecurity,Surging Threat Alerts and Risk Prioritization Gaps,"Technical reports indicate a 225% surge in monthly threat alerts and over 18,000 ransomware instances as of 2026. The data highlights a critical failure where traditional severity scores no longer accurately reflect the business impact of systemic vulnerability re-exploitation.",8,Bearish,"['Context-Aware Risk', 'Vulnerability Re-exploitation', 'Severity Scoring']",The disconnect between technical vulnerability scores and real-world business impact is forcing the industry to move toward context-aware risk modeling to handle the massive volume of threat actor activity.,https://github.com/jacobdjwilson/awesome-annual-security-reports
2026-05-12,Cybersecurity,Socio-Economic Drivers of Cyber Threat Activity,Forecasting for 2026 suggests that economic insecurity and the repurposing of federal law enforcement will create a high-activity 'playground' for threat actors. Macroeconomic instability is identified as a primary catalyst for increased cybercrime rates and reduced defensive oversight.,5,Bearish,"['Economic Insecurity', 'Threat Actor Incentive', 'Law Enforcement Pivot']","Security is not just a technical challenge; industry leaders must prepare for a landscape where socio-economic volatility drives an influx of new, financially motivated attackers.",https://www.reddit.com/r/cybersecurity/comments/1q05vev/what_is_your_most_anticipated_cybersecurity_risk/
2026-05-12,Cybersecurity,Browser Zero-Day Exploitation and CVE-2026-5281,"Google has addressed its fourth Chrome zero-day of 2026, specifically CVE-2026-5281, which was actively exploited in the wild. The frequency of these exploits demonstrates that browser-based vectors remain the most critical edge-case for enterprise security posture.",7,Bearish,"['CVE-2026-5281', 'Zero-Day', 'Browser Hardening']",The persistent exploitation of browser vulnerabilities highlights the need for more robust sandboxing and faster patch-management cycles as attackers find success in common user-facing applications.,https://www.reddit.com/r/cybersecurity/comments/1s9pq7e/google_fixes_fourth_chrome_zeroday_exploited_in/
2026-05-12,Cybersecurity,AI-Orchestrated Ransomware Efficacy Gaps,"While AI-orchestrated attacks are expected to generate significant media attention in 2026, their practical usability in high-stakes attacks remains low. Security professionals are bracing for an explosion in AI-related noise that may not correlate with actual exploit success rates.",9,Neutral,"['AI-Orchestration', 'Exploit Usability', 'Social Engineering']",The industry must differentiate between 'AI hype' and functional threat evolution to ensure that security budgets are spent on actual risks rather than theoretical automated attacks.,https://www.reddit.com/r/cybersecurity/comments/1q6j597/what_do_you_expect_from_ransomware_in_2026/
2026-05-12,Cybersecurity,EdTech Supply Chain and Data Extortion,"The threat group 'ShinyHunters' has claimed a significant breach of the Instructure Canvas platform, affecting academic access and demanding ransom payments. This incident underscores the growing risk to EdTech infrastructure and the vulnerability of centralized learning management systems.",8,Bearish,"['ShinyHunters', 'Supply Chain Breach', 'Ransomware Extortion']",Targeting educational supply chains allows threat actors to exert maximum pressure by disrupting critical student services and holding sensitive academic data for ransom.,https://www.reddit.com/r/college/comments/1t6m2ry/anyone_else_getting_this_while_trying_to_access/
2026-05-12,Consumer Tech,Multimodal Wearable Accessibility Platforms,"This signal highlights the convergence of real-time computer vision, text-to-speech, and GPS navigation into unified wearable platforms for the visually impaired. These systems integrate multimodal feedback to enable complex environmental interactions such as facial recognition and indoor navigation.",8,Bullish,"['Multimodal', 'Text-to-Speech', 'Location-Based Services']","As AI models become more efficient, the assistive tech sector is shifting from single-purpose tools to integrated ecosystems that significantly enhance user independence and market reach.",https://arxiv.org/pdf/2505.10875
2026-05-12,Consumer Tech,Mainstream Pivot to Smart Glasses Form Factors,Consumer sentiment indicates a long-term transition from high-end VR headsets like the Vision Pro toward lightweight smart glasses with broader mass-market appeal. The market anticipates that mainstream adoption will require hardware that prioritizes daily wearability over pure immersion.,7,Neutral,"['Spatial Computing', 'Augmented Reality', 'Form Factor']",The trajectory of spatial computing suggests that the industry must solve the 'comfort vs. performance' trade-off to move beyond enthusiast niches into the general consumer market.,https://www.reddit.com/r/VisionPro/comments/1rxk7ko/i_hope_apple_doesnt_abandon_the_vision_pro_at/
2026-05-12,Consumer Tech,Open-Source Edge AI for Assistive Wearables,"The use of Raspberry Pi 4 and computer vision libraries like OpenCV demonstrates a growing trend in DIY assistive hardware utilizing edge AI. By combining ultrasonic sensors with machine learning, these projects offer real-time object and facial recognition in a portable package.",5,Bullish,"['OpenCV', 'Edge AI', 'ImageAI']","Open-source development is lowering the barrier to entry for sophisticated medical and accessibility hardware, potentially disrupting high-cost proprietary solutions.",https://github.com/mohdwajid07/Assistive-Vision
2026-05-12,Consumer Tech,Economic Friction in Emerging Tech Markets,"High import taxation and aggressive customs policies in regions like Brazil are creating significant barriers to entry for the handheld gaming sector. This economic friction prevents the adoption of affordable tech, turning basic consumer electronics into high-risk luxury purchases.",4,Bearish,"['Import Taxation', 'Customs Duty', 'Market Accessibility']","Geopolitical and fiscal barriers remain a critical bottleneck for tech expansion, limiting the growth of global digital hobbies and hardware penetration in developing economies.",https://www.reddit.com/r/SBCGaming/comments/1qgnzmy/handheld_gaming_in_brazil_is_almost_unviable_for
2026-05-12,Consumer Tech,Dedicated Low-Cost Digital Imaging Hardware,There is a persistent consumer demand for specialized handheld camcorders that offer modern digital storage and features like night vision for under $300. This niche market prioritizes dedicated utility and physical controls over the multifunctional capabilities of modern smartphones.,3,Neutral,"['Night Vision', 'Digital Recording', 'CMOS Sensor']","Despite smartphone dominance, specialized hardware segments continue to exist for consumers seeking specific technical features at a fixed budget point without subscription or ecosystem lock-in.",https://www.reddit.com/r/camcorders/comments/1g5c0ab/best_handheld_camcorder_with_night_vision_under/
2026-05-12,FinTech & Web3,Multi-Chain Stablecoin Frameworks and Yield Infrastructure,The emergence of the Canton framework and Frax Finance integrations signifies a move toward enterprise-grade stablecoin issuance and cross-chain liquidity. New SDKs like Fast-SDK and pay.sh are automating the deployment of DeFi-enabled landing pages and yield-seeking vaults.,8,Bullish,"['TWAMM', 'Liquid Staking', 'Multi-chain']","Stablecoin utility is evolving from simple value storage to complex, cross-chain financial instruments that require automated deployment tools and enterprise issuance standards.",https://github.com/topics/stablecoin?o=asc&s=stars
2026-05-12,FinTech & Web3,Enterprise Web3 API and Data Infrastructure,"Major infrastructure providers like Alchemy are expanding Web3 API capabilities to include NFT data, transaction history, and webhook notifications across multiple chains. This development is supported by API-first design platforms to accelerate the integration of blockchain data into traditional B2B ecosystems.",7,Bullish,"['Webhook', 'Node Access', 'API-First']","Standardized API access is the primary bridge for traditional FinTech to consume decentralized data, reducing the technical barrier to entry for blockchain integration.",https://github.com/tools-collection/apis-collection
2026-05-12,FinTech & Web3,Decentralized Data Resource Curation,Community-driven repositories for Web3 data resources are centralizing access to blockchain analytics and dataset discovery. These resources aim to provide transparency and structured data for auditing and decentralized application development.,4,Neutral,"['Dataset', 'Analytics', 'Open Source']","As the Web3 space matures, the ability to aggregate and audit on-chain data becomes critical for regulatory compliance and institutional-grade financial analysis.",https://github.com/Hydepwns/awesome-web3-data
2026-05-12,FinTech & Web3,Privacy-Preserving Consortium Authentication,The Birthmark Standard introduces a consortium blockchain for image authentication that operates without speculative token economics. It utilizes a tiered storage protocol with 'Hot' and 'Cold' nodes to maintain a lean ledger footprint of 150 bytes per record.,6,Bullish,"['Consortium Blockchain', 'Cryptographic Proof', 'Tiered Storage']","This signals a shift toward 'utility-first' blockchain applications that prioritize privacy and integrity over financial speculation, offering a model for non-crypto enterprise adoption.",https://arxiv.org/pdf/2602.04933
2026-05-12,FinTech & Web3,Open-Source Developer Interest Tracking,Monitoring developer 'stars' on GitHub serves as a technical sentiment signal for identifying emerging tools in the Web3 ecosystem. This metadata tracks the organic growth of libraries and frameworks before they reach mass market adoption.,3,Neutral,"['Repository', 'Metadata', 'Developer Velocity']","Developer attention is a leading indicator of future ecosystem growth, helping investors identify which tech stacks will dominate the next cycle of FinTech innovation.",https://github.com/chadsr/stars
